{
  "schema_version": "1.0",
  "schema": "issue-620.schema.json",
  "schema_digest": "sha256:a609012d69c017bd289b4d5399e02de5916911af760301c7adf740e5b58fd54c",
  "decision_issue": 620,
  "rollout_issue": 653,
  "product_commit": "835bae937b9b20f5b6a82f2ee7e9a64022f95765",
  "generated_at": "2026-08-29T21:20:46.812735Z",
  "repository": "https://scm.example.invalid/example-bot/S.A.M.U.E.L-rollout-fixture",
  "cases": [
    {
      "id": "success",
      "result": "passed",
      "run": {
        "issue_number": 15,
        "issue_url": "https://scm.example.invalid/example-bot/S.A.M.U.E.L-rollout-fixture/issues/15",
        "evidence_comment_id": 40131,
        "evidence_comment_url": "https://scm.example.invalid/example-bot/S.A.M.U.E.L-rollout-fixture/issues/15#issuecomment-40131"
      },
      "branch": "rollout-620/success",
      "correlation_id": "rollout-620-success",
      "verifier_dispatches": 1,
      "terminal": {
        "event": "GateEvaluationCompleted",
        "count": 1,
        "observed_at": "2026-08-29T21:20:45.753059Z",
        "observation_key": "sha256:2ecfacf131171db0d283ea0f0b68192042c20c864fe1138aa4bd16ef0356afb4",
        "evidence_digest": "sha256:872d38d420d29ba2135534514bc5c990249bad3c9bb839a57d76265819951b25",
        "terminal_key": null,
        "gate_result_schema_version": 2,
        "observation_schema_version": 2,
        "status": null,
        "error_code": null
      },
      "subject": {
        "repository": "https://scm.example.invalid/example-bot/S.A.M.U.E.L-rollout-fixture",
        "base_sha": "17065926dfa1b36804b707744d6af006b524ed01",
        "head_sha": "b49493518b4a75d0c5db725bf340ab1718dbcf0b",
        "contract_hash": "sha256:3cf0833edde88d23f9527dfb27406c6dd67dc4431a077e756144a822693ef840",
        "policy_version": "2026-08-29.rollout-620.full.v1",
        "policy_digest": "sha256:f3738a0784b9c24cc3aa863f99cee0d263590f184cf41da6c0fff3dc6812b047"
      },
      "gate_results": [
        {
          "gate": "7b",
          "passed": true,
          "executed": true,
          "status": "passed",
          "reason_code": "gate_7b_passed",
          "reason": "Contract-Scope erfüllt: 1 Datei(en)",
          "owasp_risk": null,
          "phase": "preflight",
          "authority": "required",
          "evaluation_subject": {
            "repository": "https://scm.example.invalid/example-bot/S.A.M.U.E.L-rollout-fixture",
            "base_sha": "17065926dfa1b36804b707744d6af006b524ed01",
            "head_sha": "b49493518b4a75d0c5db725bf340ab1718dbcf0b",
            "contract_hash": "sha256:3cf0833edde88d23f9527dfb27406c6dd67dc4431a077e756144a822693ef840",
            "policy_version": "2026-08-29.rollout-620.full.v1",
            "policy_digest": "sha256:f3738a0784b9c24cc3aa863f99cee0d263590f184cf41da6c0fff3dc6812b047"
          },
          "tool": {
            "control_id": "PRG-07B",
            "scope_schema_version": 1,
            "contract_hash": "sha256:3cf0833edde88d23f9527dfb27406c6dd67dc4431a077e756144a822693ef840",
            "repository": "https://scm.example.invalid/example-bot/S.A.M.U.E.L-rollout-fixture",
            "base_sha": "17065926dfa1b36804b707744d6af006b524ed01",
            "head_sha": "b49493518b4a75d0c5db725bf340ab1718dbcf0b",
            "policy_version": "2026-08-29.rollout-620.full.v1",
            "policy_digest": "sha256:f3738a0784b9c24cc3aa863f99cee0d263590f184cf41da6c0fff3dc6812b047",
            "architecture_expansion": "disabled",
            "architecture_roles": [],
            "changed_files": [
              "rollout_fixture/preflight620.py"
            ],
            "out_of_scope": [],
            "diff_bytes": 362,
            "diff_digest": "sha256:0631a84179b35341a56404184b554ecb164526412838015d656df80fdf40ee60"
          }
        },
        {
          "gate": 8,
          "passed": true,
          "executed": true,
          "status": "passed",
          "reason_code": "gate_8_passed",
          "reason": "Keine Cross-Slice-Imports",
          "owasp_risk": null,
          "phase": "preflight",
          "authority": "required",
          "evaluation_subject": {
            "repository": "https://scm.example.invalid/example-bot/S.A.M.U.E.L-rollout-fixture",
            "base_sha": "17065926dfa1b36804b707744d6af006b524ed01",
            "head_sha": "b49493518b4a75d0c5db725bf340ab1718dbcf0b",
            "contract_hash": "sha256:3cf0833edde88d23f9527dfb27406c6dd67dc4431a077e756144a822693ef840",
            "policy_version": "2026-08-29.rollout-620.full.v1",
            "policy_digest": "sha256:f3738a0784b9c24cc3aa863f99cee0d263590f184cf41da6c0fff3dc6812b047"
          }
        },
        {
          "gate": 9,
          "passed": true,
          "executed": true,
          "status": "passed",
          "reason_code": "gate_9_passed",
          "reason": "1 Candidate-Python-Datei(en) syntaktisch korrekt",
          "owasp_risk": null,
          "phase": "preflight",
          "authority": "required",
          "evaluation_subject": {
            "repository": "https://scm.example.invalid/example-bot/S.A.M.U.E.L-rollout-fixture",
            "base_sha": "17065926dfa1b36804b707744d6af006b524ed01",
            "head_sha": "b49493518b4a75d0c5db725bf340ab1718dbcf0b",
            "contract_hash": "sha256:3cf0833edde88d23f9527dfb27406c6dd67dc4431a077e756144a822693ef840",
            "policy_version": "2026-08-29.rollout-620.full.v1",
            "policy_digest": "sha256:f3738a0784b9c24cc3aa863f99cee0d263590f184cf41da6c0fff3dc6812b047"
          },
          "tool": {
            "name": "cpython.ast",
            "version": "3.13.5"
          }
        },
        {
          "gate": "13a",
          "passed": true,
          "executed": true,
          "status": "passed",
          "reason_code": "gate_13a_passed",
          "reason": "Branch 0 Commits hinter main",
          "owasp_risk": null,
          "phase": "preflight",
          "authority": "required",
          "evaluation_subject": {
            "repository": "https://scm.example.invalid/example-bot/S.A.M.U.E.L-rollout-fixture",
            "base_sha": "17065926dfa1b36804b707744d6af006b524ed01",
            "head_sha": "b49493518b4a75d0c5db725bf340ab1718dbcf0b",
            "contract_hash": "sha256:3cf0833edde88d23f9527dfb27406c6dd67dc4431a077e756144a822693ef840",
            "policy_version": "2026-08-29.rollout-620.full.v1",
            "policy_digest": "sha256:f3738a0784b9c24cc3aa863f99cee0d263590f184cf41da6c0fff3dc6812b047"
          }
        },
        {
          "gate": "13b",
          "passed": true,
          "executed": true,
          "status": "passed",
          "reason_code": "gate_13b_passed",
          "reason": "Diff nicht destruktiv",
          "owasp_risk": null,
          "phase": "preflight",
          "authority": "required",
          "evaluation_subject": {
            "repository": "https://scm.example.invalid/example-bot/S.A.M.U.E.L-rollout-fixture",
            "base_sha": "17065926dfa1b36804b707744d6af006b524ed01",
            "head_sha": "b49493518b4a75d0c5db725bf340ab1718dbcf0b",
            "contract_hash": "sha256:3cf0833edde88d23f9527dfb27406c6dd67dc4431a077e756144a822693ef840",
            "policy_version": "2026-08-29.rollout-620.full.v1",
            "policy_digest": "sha256:f3738a0784b9c24cc3aa863f99cee0d263590f184cf41da6c0fff3dc6812b047"
          }
        },
        {
          "gate": 11,
          "passed": true,
          "executed": true,
          "status": "passed",
          "reason_code": "gate_11_passed",
          "reason": "Alle 2 Kriterien am Candidate nachgewiesen",
          "owasp_risk": null,
          "phase": "post_candidate",
          "authority": "required",
          "evaluation_subject": {
            "repository": "https://scm.example.invalid/example-bot/S.A.M.U.E.L-rollout-fixture",
            "base_sha": "17065926dfa1b36804b707744d6af006b524ed01",
            "head_sha": "b49493518b4a75d0c5db725bf340ab1718dbcf0b",
            "contract_hash": "sha256:3cf0833edde88d23f9527dfb27406c6dd67dc4431a077e756144a822693ef840",
            "policy_version": "2026-08-29.rollout-620.full.v1",
            "policy_digest": "sha256:f3738a0784b9c24cc3aa863f99cee0d263590f184cf41da6c0fff3dc6812b047"
          }
        }
      ],
      "acceptance_evidence": {
        "schema_version": 1,
        "evaluation_subject": {
          "repository": "https://scm.example.invalid/example-bot/S.A.M.U.E.L-rollout-fixture",
          "base_sha": "17065926dfa1b36804b707744d6af006b524ed01",
          "head_sha": "b49493518b4a75d0c5db725bf340ab1718dbcf0b",
          "contract_hash": "sha256:3cf0833edde88d23f9527dfb27406c6dd67dc4431a077e756144a822693ef840",
          "policy_version": "2026-08-29.rollout-620.full.v1",
          "policy_digest": "sha256:f3738a0784b9c24cc3aa863f99cee0d263590f184cf41da6c0fff3dc6812b047"
        },
        "contract": {
          "schema_version": 2,
          "revision": "1",
          "contract_hash": "sha256:3cf0833edde88d23f9527dfb27406c6dd67dc4431a077e756144a822693ef840",
          "criteria": [
            {
              "criterion_id": "AC-1028454b294aae8e",
              "tag": "DIFF",
              "text": "rollout_fixture/preflight620.py",
              "mode": "automatic",
              "required": true
            },
            {
              "criterion_id": "AC-98d2177fdaf6c588",
              "tag": "GREP",
              "text": "\"ROLLOUT_620_SUCCESS = True\" rollout_fixture/preflight620.py",
              "mode": "automatic",
              "required": true
            }
          ],
          "scope": {
            "schema_version": 1,
            "entries": [
              {
                "kind": "file",
                "value": "rollout_fixture/preflight620.py"
              }
            ],
            "architecture_expansion": "disabled"
          },
          "approval": {
            "state": "approved",
            "actor": "rollout-operator",